<?xml version="1.0" encoding="UTF-8"?>
<!--
  ~ Licensed to the Koordinierungsstelle fÃ¼r IT-Standards (KoSIT) under
  ~ one or more contributor license agreements. See the NOTICE file
  ~ distributed with this work for additional information
  ~ regarding copyright ownership.  KoSIT licenses this file
  ~ to you under the Apache License, Version 2.0 (the
  ~ "License"); you may not use this file except in compliance
  ~ with the License. You may obtain a copy of the License at
  ~
  ~ http://www.apache.org/licenses/LICENSE-2.0
  ~
  ~ Unless required by applicable law or agreed to in writing,
  ~ software distributed under the License is distributed on an
  ~ "AS IS" BASIS, WITHOUT WARRANTIES OR CONDITIONS OF ANY
  ~ KIND, either express or implied. See the License for the
  ~ specific language governing permissions and limitations
  ~ under the License.
  -->

<assertions xmlns:xsi="http://www.w3.org/2001/XMLSchema-instance"
            xmlns="http://www.xoev.de/de/validator/framework/1/assertions"
            xsi:schemaLocation="http://www.xoev.de/de/validator/framework/1/assertions file:/C:/fb/svn/xoev/produkte/prueftool/trunk/xsd/assertions.xsd">

    <namespace prefix="rep">http://www.xoev.de/de/validator/varl/1</namespace>

    <assertion report-doc="ubl-0001.xml" test="/rep:report/rep:scenarioMatched/rep:validationStepResult/@id = 'xsd'">
        Schema wurde validiert
    </assertion>
    <assertion report-doc="ubl-0001.xml" test="/rep:report/rep:scenarioMatched/rep:validationStepResult/@id = 'sch.1'">
        Schematron wurde validiert
    </assertion>
    <assertion report-doc="ubl-0001.xml" test="/rep:report/rep:assessment/rep:accept">Empfehlung zur Annahme</assertion>

    <assertion report-doc="ubl-0002.xml"
               test="/rep:report/rep:scenarioMatched/rep:validationStepResult/@id = 'val-xsd'">Schema wurde validiert
    </assertion>
    <assertion report-doc="ubl-0002.xml" test="/rep:report/rep:scenarioMatched/rep:validationStepResult/@id = 'sch.1'">
        Schematron wurde validiert
    </assertion>
    <assertion report-doc="ubl-0002.xml" test="/rep:report/rep:assessment/rep:accept">Empfehlung zur Ablehnung
    </assertion>


</assertions>
